answer,order_number,value,is_daily_double,correct_response,responder,is_correct,category,round_num,episode
"It was the wolf's reply to Red's comment, ""Grandmother, what large eyes you have""",16,200,False,the better to see you with,Ken,True,LITTLE RED RIDING HOOD,1,3
The shortwave band begins at about 1700 these units abbreviated kHz; below that you're in AM territory,26,200,False,kilohertz,Ken,True,SHORTWAVE,1,3
"This popcorn magnate burst into the world on July 16, 1907 in Brazil, Indiana",21,200,False,Orville Redenbacher,Ken,True,SMALL TOWN FOLKS,1,3
The only native mammal in Micronesia is this flying one,11,200,False,a bat,Ken,True,MICRONESIA,1,3
"Probably the most famous ukulele player to have a top 40 hit, his name came from a Charles Dickens character",2,200,False,Tiny Tim,Ken,True,"A ""TINY"" CATEGORY",1,3
"My newt, seen here, gets offended when people call it a lizard--it's obviously one of these amphibians",1,200,False,a salamander,Adam,True,MY NEWT,1,3
"In the 1934 Disney cartoon ""The Big Bad Wolf"", this trio warns Red about the wolf waiting at Grandma's house",17,400,False,the Three Little Pigs,Ken,True,LITTLE RED RIDING HOOD,1,3
"Mainly funded by the CIA, this broadcasting operation began transmitting behind the Iron Curtain in 1949",27,400,False,Radio Free Europe,Ken,True,SHORTWAVE,1,3
"As a player, this man led tiny Williston, N.D. High to the state basketball championships",22,400,False,Phil Jackson,Ken,True,SMALL TOWN FOLKS,1,3
In the 1950s Enewetak & this atoll consisted the Pacific proving ground of the U.S. Atomic Energy Commission,12,400,False,Bikini Atoll,Ken,True,MICRONESIA,1,3
Leon Prober composed this Don Ho standard,7,400,False,"""Tiny Bubbles""",Ken,True,"A ""TINY"" CATEGORY",1,3
"When my newt developed this pair of organs, it was ready to start living on land & be called an eft",3,400,False,lungs,Ken,True,MY NEWT,1,3
"In the Grimms' version, this character was added to save Red's life after the wolf had devoured her",18,600,False,the woodsman,Ken,True,LITTLE RED RIDING HOOD,1,3
"One book calls this 12-letter word the ""arch-enemy of shortwave listeners""; I just call it annoying",28,600,False,interference,Ken,True,SHORTWAVE,1,3
"Last name of Cecile, Yvonne, Annette, Emelie, & Marie, born May 28, 1934 in the village of Callendar, Ontario",23,"4,200",True,Dionne,Ken,True,SMALL TOWN FOLKS,1,3
"The name Micronesia comes from 2 Greek words, micro & nesos, which mean this",13,600,False,small island,Ken,True,MICRONESIA,1,3
1980s Boston Celtics standout Nate,8,600,False,"""Tiny"" Archibald",Adam,True,"A ""TINY"" CATEGORY",1,3
My newt takes pride in how carefully female newts attach these individually to aquatic plants,4,600,False,her eggs,Ken,True,MY NEWT,1,3
"""Lil' Red Riding Hood"" was a No. 2 hit in 1966 for Sam the Sham & this group",19,800,False,The Pharaohs,Ken,True,LITTLE RED RIDING HOOD,1,3
This service that broadcasts from Abuja & Lagos has a name reflecting that of the USA's official radio service,29,800,False,Voice of Nigeria,Ken,False,SHORTWAVE,1,3
"This bandleader whose hit is heard here grew up in the small towns of Clarinda, Iowa; Tryon, Neb.; & Grant City, Mo.",24,800,False,Glenn Miller,Adam,True,SMALL TOWN FOLKS,1,3
"In Agana, the capital of this U.S. territory, you can visit Latte Stone Park & see stone pillars from a prehistoric people",14,800,False,Guam,Ken,True,MICRONESIA,1,3
This TV show featured younger versions of classic Warner Bros. animated characters,9,800,False,Tiny Toon Adventures (Tiny Toons accepted),Ken,True,"A ""TINY"" CATEGORY",1,3
It's no fun for my newt to hug his European cousin named for these bumps attributed to toads,5,800,False,warts,Ken,True,MY NEWT,1,3
"""Little Red Riding Hood"" was first written as ""Le Petit Chaperon Rouge"" in 1697 by this French fairy tale compiler",20,1000,False,Charles Perrault,Ken,True,LITTLE RED RIDING HOOD,1,3
"To catch the BBC at 1700 UTC, or Universal Time Coordinated, tune in at this morning hour Pacific Standard time",30,1000,False,9:00 AM,Triple Stumper,False,SHORTWAVE,1,3
"From Dublin, Mich. this actor & Verizon spokesman first used a phone when he won a college scholarship",25,1000,False,James Earl Jones,Ken,True,SMALL TOWN FOLKS,1,3
Most of the Caroline Islands are now a part of this independent country known as FSM for short,15,1000,False,the Federated States of Micronesia,Laura,True,MICRONESIA,1,3
"In the Oscar-nominated song, the 3 words that follow ""Thumbelina, Thumbelina...""",10,1000,False,"""Tiny Little Thing""",Ken,True,"A ""TINY"" CATEGORY",1,3
My newt wonders why newts aren't a Japanese delicacy like this fish that secretes the same poison,6,1000,False,blowfish (or fugu),Ken,True,MY NEWT,1,3
"If a chunk of this New England city's Travelers Tower falls on you, we're confident they're insured",21,400,False,"Hartford, Connecticut",Laura,True,TALL BUILDINGS,2,3
"In 1946, Elmore Morgenthaler was the first NBA player with this physical distinction",3,400,False,being 7 feet tall,Ken,True,SPORTS GIANTS,2,3
"This ""male"" brand of frozen dinners contains more than 1 pound of food; the XXL line has 1 1/2 pounds",1,400,False,Hungry-Man,Ken,True,HEAPING PORTIONS,2,3
NASA has 134 of these & has no current plan to hire more,7,400,False,astronauts,Ken,True,LOTS OF SPACE,2,3
"The shortest ""war"" in history, 45 minutes, occured in 1896 between Zanzibar & naval forces of this vast empire",26,400,False,the British Empire,Ken,True,THE VAST & THE FURIOUS,2,3
"A person who fought against slavery, like John Brown, was termed this 12-letter word",16,400,False,abolitionist,Ken,True,BIG WORDS,2,3
Manhattan's Lever House helped usher in the era of the building style known as a box of this material,22,800,False,glass,Ken,True,TALL BUILDINGS,2,3
"Through 2003 this pitcher now with Arizona had 3,871 strikeouts in 3,122 innings",12,800,False,Randy Johnson,Ken,True,SPORTS GIANTS,2,3
The Overtons named this restaurant for a certain dessert; it's known for its large menu & giant portions,2,800,False,Cheesecake Factory,Adam,True,HEAPING PORTIONS,2,3
"On August 27, 2003 this planet reached its closest point to Earth in nearly 60,000 years",8,800,False,Mars,Ken,True,LOTS OF SPACE,2,3
This nation of 200 million has fought small independence movements like those in Aceh & East Timor,27,800,False,Indonesia,Adam,True,THE VAST & THE FURIOUS,2,3
"This instrument, often attached to an inflatable cuff, is used to measure blood pressure",17,800,False,a sphygmomanometer,Adam,True,BIG WORDS,2,3
You might expect decor by Michelangelo at the over 500-foot towers with this name in Dallas & Detroit,23,1200,False,Renaissance,Ken,True,TALL BUILDINGS,2,3
North-of-the-border star athlete seen here,13,1200,False,Vince Carter,Adam,True,SPORTS GIANTS,2,3
A 32-ounce soft drink at 7-Eleven has this trademarked name,4,1200,False,Big Gulp,Ken,True,HEAPING PORTIONS,2,3
"In 1965, Belyayev just had to sit there while his partner Leonov became the first to do this",9,1200,False,walk in space,Ken,True,LOTS OF SPACE,2,3
,,,,,,,THE VAST & THE FURIOUS,2,3
"This 11-letter word for ""sleight of hand"" is from the French for ""light of hand""",18,1200,False,legerdemain,Ken,False,BIG WORDS,2,3
"The Jin Mao Building, China's tallest, is in this commercial center in the east of the country",24,1600,False,Shanghai,Ken,True,TALL BUILDINGS,2,3
"Known as ""Tooz"", he played defensive line for the Raiders & played Tonda in the film ""Caveman""",14,1600,False,John Matuszak,Adam,True,SPORTS GIANTS,2,3
"(Jimmy of the Clue Crew points to three stacks of different-sized paper cups in a Starbucks in Seattle, Washington.)  At Starbucks, tall is only 12 ounces, grande is 16 ounces & this, Italian for 20, is 20 ounces",5,1600,False,venti,Laura,True,HEAPING PORTIONS,2,3
"In 1945 this ""Space Odyssey"" author suggested a space-based telecommunication system",10,1600,False,Arthur Clarke,Ken,True,LOTS OF SPACE,2,3
,,,,,,,THE VAST & THE FURIOUS,2,3
This adjective refers to a 150th anniversary,19,1600,False,sesquicentennial,Ken,True,BIG WORDS,2,3
"This establishment, seen here, isn't in Asia, but in Atlantic City",25,2000,False,the Taj Mahal,Adam,True,TALL BUILDINGS,2,3
(I'm Hall of Famer Dan Hampton.)  My Hall of Fame biography mentions this beastly nickname that came from my first name & my fierce attitude,15,2000,False,"""Danimal""",Triple Stumper,False,SPORTS GIANTS,2,3
This bottle size named for one of the Magi is the equivalent of 16 standard bottles of wine,6,"1,000",True,Balthazar,Laura,True,HEAPING PORTIONS,2,3
Try & come up with this name of the Apollo 15 command module or the shuttle first launched in 1992,11,2000,False,Endeavor,Ken,True,LOTS OF SPACE,2,3
,,,,,,,THE VAST & THE FURIOUS,2,3
"28-letter term for opposition to the withdrawal of state support, as for the Anglican church",20,"5,600",True,antidisestablishmentarianism,Ken,True,BIG WORDS,2,3
